{
  "$schema": "http://json-schema.org/draft-07/schema#",
  "$id": "fif-incomplete.json",
  "type": "object",
  "title": "Schema for Fedora Intermediate Format (FIF) openQA job template data before products defaults merge",
  "anyOf": [
    { "required": [ "Machines" ]},
    { "required": [ "Products" ]},
    { "required": [ "Profiles" ]},
    { "required": [ "TestSuites" ]}
  ],
  "properties": {
    "Machines": { "$ref": "fif-machines.json" },
    "Flavors": { "$ref": "fif-flavors.json" },
    "ProductDefaults": { "$ref": "fif-productdefaults.json" },
    "Products": { "$ref": "fif-products-predefault.json" },
    "ProfileGroups": { "$ref": "fif-profilegroups.json" },
    "Profiles": { "$ref": "fif-profiles.json" },
    "TestSuites": { "$ref": "fif-testsuites.json" },
    "JobTemplates": { "$ref": "openqa-jobtemplates.json" }
  },
  "additionalProperties": false
}

